{
  "id": "VA_DEPOSIT_CAP",
  "jurisdiction": "VA",
  "citation": "Va. Code § 55.1-1226(A)",
  "sourceUrl": "https://law.lis.virginia.gov/vacode/title55.1/chapter12/section55.1-1226/",
  "versions": [
    {
      "effectiveFrom": "2019-10-01",
      "effectiveUntil": null,
      "statuteQuote": "No landlord may demand or receive a security deposit, however denominated, in an amount or value in excess of two months' periodic rent.",
      "snapshotFile": "snapshots/55.1-1226@2026-10-25.txt"
    }
  ],
  "checkType": "deterministic",
  "deterministic": { "fn": "securityDepositCap", "inputs": ["securityDeposit", "monthlyRent"] },
  "summaryForModel": "A security deposit, whatever it is called, cannot exceed two months' rent.",
  "paraphraseExamples": [
    "Tenant shall deliver a security deposit equal to three months' rent.",
    "A refundable damage deposit of $4,000 is due at signing (monthly rent $1,500)."
  ],
  "tenantExplanation": "Virginia limits a security deposit to two months' rent. A landlord can't ask for more.",
  "action": "You can ask your landlord to lower the deposit to two months' rent or less.",
  "severityIfViolated": "unenforceable"
}
